{"authority":"NONE","blocking_findings":[],"findings":["git rev-parse HEAD = 3de5b82552f39d6c319f5171ed22911b4ca89d75, exactly matching verified_candidate_revision.","git merge-base --is-ancestor cf6c55fe5fadd389dcd34132514b88e1bc92bcd8 HEAD exited 0: base revision is an ancestor of HEAD.","git diff --name-only cf6c55f..HEAD lists exactly one path, docs/sscm-dogfood.txt, matching expected_changed_files with no extra or missing entries.","git show HEAD:docs/sscm-dogfood.txt is 18 bytes: 'SOVEREIGN_SSCM_OK' followed by a single trailing LF (od -c confirms 0x0A at offset 021 and EOF at 022; no CR, no BOM, no second newline). sha256 5f809db0924655219bb200d5f385da0ce4809d1ac880c93db9c1405db2e3ce34 equals the sha256 of the expected content byte-for-byte.","git status --porcelain produced no output: working tree and index are clean, no untracked residue.","Scope check (informational, not part of checklist): range cf6c55f..HEAD contains a single commit 3de5b82 'dogfood: SSCM artifact-bound handoff' with diffstat '1 file changed, 1 insertion(+)' — no incidental edits or side effects."],"reviewed_revision":"3de5b82552f39d6c319f5171ed22911b4ca89d75","role":"REVIEWER","summary":"Read-only review of revision 3de5b82 against base cf6c55f in the reviewer worktree. All five checklist items pass: HEAD equals the verified candidate revision; the base is an ancestor of HEAD; the changed-file set is exactly docs/sscm-dogfood.txt; the committed file content is byte-for-byte 'SOVEREIGN_SSCM_OK' plus one trailing newline (verified by od -c and matching sha256 5f809db0...ce34); and the working tree is clean with no residue. The range contains a single commit touching one file with one insertion, so there are no out-of-scope changes. No modifications, commits, or repairs were made. Verdict: ACCEPT, with no blocking findings.","tests_run":["git rev-parse HEAD","git merge-base --is-ancestor cf6c55fe5fadd389dcd34132514b88e1bc92bcd8 HEAD","git diff --name-only cf6c55fe5fadd389dcd34132514b88e1bc92bcd8..HEAD","git show HEAD:docs/sscm-dogfood.txt | od -c","git show HEAD:docs/sscm-dogfood.txt | sha256sum (compared against printf 'SOVEREIGN_SSCM_OK\\n' | sha256sum)","git status --porcelain","git diff --stat cf6c55fe5fadd389dcd34132514b88e1bc92bcd8..HEAD","git log --oneline cf6c55fe5fadd389dcd34132514b88e1bc92bcd8..HEAD","git ls-tree -r HEAD -- docs/"],"verdict":"ACCEPT"}
