{"authority":"NONE","blocking_findings":[],"findings":["HEAD check: git rev-parse HEAD == 916826117fcd3cdf729966ebf7db5c063ed65583, equal to verified_integrated_revision.","Ancestry check: git merge-base --is-ancestor 97d33978e2b416334194b27bba1ae03f514b661a HEAD exited 0.","Changed-file check: git diff --name-only <base>..HEAD listed exactly docs/sscm-fanout-a.txt and docs/sscm-fanout-b.txt, matching expected_changed_files with no extras.","Content check (byte-for-byte): git ls-tree HEAD docs/ gives blob 10c60dc75a5b8536c725f7640f61bc50922cbcc2 for docs/sscm-fanout-a.txt and 41cbbe57fe3ed5fe0ccbfa42f6f25f4ebde20e7f for docs/sscm-fanout-b.txt; git hash-object --stdin over the expected literals 'SSCM_FANOUT_A_OK\\n' and 'SSCM_FANOUT_B_OK\\n' produced the identical two ids. Blob-id equality is exact byte equality, including the trailing newline.","Receipt worker_candidates check: task:fanout-a has imported_sha == verified_sha == 7531f8031097dcec47100da161809eede33d763c == instruction verified_worker_a_revision; task:fanout-b has imported_sha == verified_sha == 6a8c1a21f45c8e1a827fe64adc88ee051597c4aa == instruction verified_worker_b_revision. Exactly two candidates, no others.","Working tree check: git status --porcelain produced no output (clean), so the inspected worktree matches HEAD.","History shape: git rev-list --parents <base>..HEAD shows a linear single-parent chain 97d3397 -> a84fdc87e2ef37d0527ddb0f6e6aeb5250a987ee -> 9168261, i.e. exactly two commits, no merge commits.","Integration order: commit a84fdc8 ('dogfood: SSCM fan-out task:fanout-a') touches only docs/sscm-fanout-a.txt and commit 9168261 ('dogfood: SSCM fan-out task:fanout-b') touches only docs/sscm-fanout-b.txt, consistent with the receipt's frozen integration_order [task:fanout-a, task:fanout-b] and one-file-per-task disjointness.","Ref check: git for-each-ref refs/sscm/ in this repo resolves refs/sscm/import/integrated to 916826117fcd3cdf729966ebf7db5c063ed65583.","NON-BLOCKING observation: the worker source commits 7531f803... and 6a8c1a21... are not reachable from this reviewer object store (git cat-file -t returned 'could not get object info'), and refs/sscm/import/fanout-a and refs/sscm/import/fanout-b are absent here; only refs/sscm/import/integrated exists in reviewer.git. Cherry-pick provenance therefore could not be independently re-derived (e.g. by patch-id comparison) from this worktree. It was verified only via the receipt's internal consistency plus exact content equality of the integrated result, which satisfies every stated checklist item.","SCOPE NOTE: two Bash invocations were denied by the permission mode (an od/sha256sum content dump and a command-substitution form of git cat-file -s). The content requirement was satisfied instead by git blob-id comparison, which is an equivalent-or-stronger byte-for-byte test; no checklist item was left unverified."],"reviewed_revision":"916826117fcd3cdf729966ebf7db5c063ed65583","role":"REVIEWER","summary":"All six checklist items pass at revision 916826117fcd3cdf729966ebf7db5c063ed65583 in the reviewer worktree. HEAD equals verified_integrated_revision; base 97d33978e2b416334194b27bba1ae03f514b661a is an ancestor; the base..HEAD diff lists exactly docs/sscm-fanout-a.txt and docs/sscm-fanout-b.txt; both files match expected content byte-for-byte (verified by blob-id equality against git hash-object over the expected literals, trailing newline included); the receipt's two worker_candidates have imported_sha == verified_sha and equal the instruction's verified worker A and B revisions exactly; and git status --porcelain is empty. History is a clean linear two-commit chain in the frozen task-id order, each commit touching only its own task's file. One non-blocking observation: the worker source commits and their refs/sscm/import/fanout-* refs are not present in the reviewer object store, so cherry-pick provenance could not be independently re-derived here — it rests on receipt consistency plus exact content equality of the integrated tree. Two Bash calls were denied by the permission mode; the affected content check was satisfied by an equivalent blob-id comparison, so no checklist item went unverified. Review was read-only; nothing was modified, committed, or repaired. Verdict: ACCEPT.","tests_run":["git rev-parse HEAD","git merge-base --is-ancestor 97d33978e2b416334194b27bba1ae03f514b661a HEAD","git diff --name-only 97d33978e2b416334194b27bba1ae03f514b661a..HEAD","git status --porcelain","git ls-tree HEAD docs/","printf 'SSCM_FANOUT_A_OK\\n' | git hash-object --stdin","printf 'SSCM_FANOUT_B_OK\\n' | git hash-object --stdin","git rev-list --parents 97d33978e2b416334194b27bba1ae03f514b661a..HEAD","git show --name-only --no-decorate a84fdc8","git show --name-only --no-decorate 9168261","git for-each-ref refs/sscm/","git cat-file -t 7531f8031097dcec47100da161809eede33d763c (object absent in reviewer repo)","git cat-file -t 6a8c1a21f45c8e1a827fe64adc88ee051597c4aa (object absent in reviewer repo)","git rev-parse --git-dir --git-common-dir"],"verdict":"ACCEPT"}
