{"authority":"NONE","blocking_findings":[],"findings":["git rev-parse HEAD = 2a93e1d66b7a3c3edb4dc069e0fe2ff5c3d97f06, equals verified_final_revision.","Ancestry linear and correct: c7a4b16b22ff3551802182577953681749a782bd -> 6edb3a2ac4dd1ce7a2595fe47c5ba8d8c7a47f21 -> 2a93e1d66b7a3c3edb4dc069e0fe2ff5c3d97f06; rev-list --parents confirms each candidate has exactly the prior revision as its single parent, and base..HEAD contains exactly the two candidate commits.","evaluation_1 (eval:ca370a16-a94f-4c23-a5a8-2d4194a50d88) binds candidate_ref git:6edb3a2... = candidate_1 with disposition FAIL as stated; its finding is independently corroborated: blob docs/sscm-repair-dogfood.txt at candidate_1 is 'SSCM_REPAIR_SEED\\n' with sha256 875b389ff9159d2ff087a4bc428aab7eb519684d4675cc090508336985a002c6 (prefix 875b389ff915), != expected f195483e251a.","Exactly one repair occurred (one repair candidate commit) and exactly one repair_authorization is present in the instruction; its evaluation_id matches evaluation_1's evaluation_id.","evaluation_2 (eval:e76a438d-a6ba-48ea-bd97-37beaef4eb94) binds candidate_ref git:2a93e1d... = candidate_2 = HEAD with disposition PASS and no findings.","git diff --name-only c7a4b16..HEAD lists exactly docs/sscm-repair-dogfood.txt (diffstat: 1 file changed, 1 insertion); no other paths touched.","Content byte-exact: HEAD blob and worktree file both sha256 f195483e251af734990c006b46e136ca0c907d0699d1b078c5cf0213a5cdefa3; od -c shows exactly 'SSCM_REPAIR_OK\\n' (15 bytes, single trailing newline, no CR).","git status --porcelain is empty; worktree clean, no untracked or staged residue.","Scope limitation (non-blocking): the run ledger at run:mission-sscm-01c-live-1 (evaluation records and artifacts/repair-instruction.json) is outside the review worktree and file tools are --restricted to it, so repair_instruction_ref.sha256 and the ledger-side existence/uniqueness of the evaluation and repair-authorization records could not be re-derived from source. Checklist items 3 and 4 were verified for internal consistency of the instruction payload and corroborated against independently computed git evidence."],"reviewed_revision":"2a93e1d66b7a3c3edb4dc069e0fe2ff5c3d97f06","role":"REVIEWER","summary":"All five checklist items pass at revision 2a93e1d66b7a3c3edb4dc069e0fe2ff5c3d97f06. HEAD equals verified_final_revision and the worktree is clean. The candidate chain is strictly linear from the canonical base (c7a4b16 -> 6edb3a2 -> 2a93e1d), each with a single expected parent and no extra commits. base..HEAD changes exactly docs/sscm-repair-dogfood.txt, whose HEAD blob and on-disk content are byte-exact 'SSCM_REPAIR_OK\\n' (sha256 f195483e251a...), matching expected_content. The stated evaluation_1 FAIL is independently corroborated: candidate_1's blob is 'SSCM_REPAIR_SEED\\n' with sha256 875b389ff915..., exactly the mismatch cited. Exactly one repair occurred and exactly one repair authorization is present, keyed to evaluation_1's evaluation_id; evaluation_2 binds candidate_2 with disposition PASS. One non-blocking limitation: the run ledger and artifacts/repair-instruction.json lie outside the review worktree and were unreadable under the restricted file tools, so repair_instruction_ref.sha256 and ledger-side record uniqueness were not re-derived from source; those aspects rest on the instruction payload plus corroborating git evidence. No blocking findings. Review was read-only; nothing was modified, committed, or repaired.","tests_run":["git rev-parse HEAD","git status --porcelain","git merge-base --is-ancestor c7a4b16b22ff3551802182577953681749a782bd 6edb3a2ac4dd1ce7a2595fe47c5ba8d8c7a47f21","git merge-base --is-ancestor 6edb3a2ac4dd1ce7a2595fe47c5ba8d8c7a47f21 2a93e1d66b7a3c3edb4dc069e0fe2ff5c3d97f06","git rev-list --parents -n 2 2a93e1d66b7a3c3edb4dc069e0fe2ff5c3d97f06","git log --oneline c7a4b16..2a93e1d","git diff --name-only c7a4b16b22ff3551802182577953681749a782bd..2a93e1d66b7a3c3edb4dc069e0fe2ff5c3d97f06","git diff --stat c7a4b16b22ff3551802182577953681749a782bd..2a93e1d66b7a3c3edb4dc069e0fe2ff5c3d97f06","git show 2a93e1d:docs/sscm-repair-dogfood.txt | sha256sum","git show 2a93e1d:docs/sscm-repair-dogfood.txt | od -c","git show 6edb3a2:docs/sscm-repair-dogfood.txt | sha256sum","git show 6edb3a2:docs/sscm-repair-dogfood.txt | od -c","sha256sum docs/sscm-repair-dogfood.txt"],"verdict":"ACCEPT"}
